{
  "schemaVersion": "1.0.0",
  "id": "max-wizardry-summoner-base",
  "rulesetId": "mu-s4-global-reference",
  "formulaRef": { "id": "formula-max-wizardry-summoner", "version": "1.0.0" },
  "context": { "characterClassId": "class-summoner", "evolutionId": "evolution-summoner" },
  "inputs": { "energy": 23 },
  "expectedTrace": {
    "schemaVersion": "1.0.0",
    "id": "trace-max-wizardry-summoner-base",
    "rulesetId": "mu-s4-global-reference",
    "formulaRef": { "id": "formula-max-wizardry-summoner", "version": "1.0.0" },
    "context": { "characterClassId": "class-summoner", "evolutionId": "evolution-summoner" },
    "inputs": { "energy": 23 },
    "steps": [
      { "stepId": "raw-max-wizardry-damage", "value": 5.75 },
      { "stepId": "visible-max-wizardry-damage", "value": 5 }
    ],
    "rounding": { "mode": "TRUNCATE", "stage": "visible-max-wizardry-damage", "decimalPlaces": 0 },
    "rawOutput": 5.75,
    "visibleOutput": 5,
    "evidenceRefs": ["evd-0021", "evd-0026"],
    "conflictIds": []
  }
}