{
  "schemaVersion": "1.0.0",
  "id": "nova-max-spell-damage-dark-wizard-fraction-step",
  "rulesetId": "mu-s4-global-reference",
  "formulaRef": {
    "id": "formula-nova-max-spell-damage-dark-wizard",
    "version": "1.0.0"
  },
  "context": {
    "characterClassId": "class-dark-wizard",
    "evolutionId": "evolution-dark-wizard"
  },
  "inputs": {
    "strength": 19
  },
  "expectedTrace": {
    "schemaVersion": "1.0.0",
    "id": "trace-nova-max-spell-damage-dark-wizard-fraction-step",
    "rulesetId": "mu-s4-global-reference",
    "formulaRef": {
      "id": "formula-nova-max-spell-damage-dark-wizard",
      "version": "1.0.0"
    },
    "context": {
      "characterClassId": "class-dark-wizard",
      "evolutionId": "evolution-dark-wizard"
    },
    "inputs": {
      "strength": 19
    },
    "steps": [
      {
        "stepId": "strength-term",
        "value": 9.5
      },
      {
        "stepId": "raw-nova-max-spell-damage",
        "value": 1329.5
      },
      {
        "stepId": "visible-nova-max-spell-damage",
        "value": 1329
      }
    ],
    "rounding": {
      "mode": "TRUNCATE",
      "stage": "visible-nova-max-spell-damage",
      "decimalPlaces": 0
    },
    "rawOutput": 1329.5,
    "visibleOutput": 1329,
    "evidenceRefs": [
      "evd-0021",
      "evd-0026"
    ],
    "conflictIds": []
  }
}