{
  "schemaVersion": "1.0.0",
  "id": "sd-dark-knight-level-step",
  "rulesetId": "mu-s4-global-reference",
  "formulaRef": { "id": "formula-sd-dark-knight", "version": "1.0.0" },
  "context": { "characterClassId": "class-dark-knight", "evolutionId": "evolution-blade-knight" },
  "inputs": {
    "character-level": 2,
    "strength": 28,
    "agility": 20,
    "vitality": 25,
    "energy": 10,
    "defense": 6.6666666666666666666666666667
  },
  "expectedTrace": {
    "schemaVersion": "1.0.0",
    "id": "trace-sd-dark-knight-level-step",
    "rulesetId": "mu-s4-global-reference",
    "formulaRef": { "id": "formula-sd-dark-knight", "version": "1.0.0" },
    "context": { "characterClassId": "class-dark-knight", "evolutionId": "evolution-blade-knight" },
    "inputs": {
      "character-level": 2,
      "strength": 28,
      "agility": 20,
      "vitality": 25,
      "energy": 10,
      "defense": 6.6666666666666666666666666667
    },
    "steps": [
      { "stepId": "stat-sum", "value": 83 },
      { "stepId": "stat-contribution", "value": 99.6 },
      { "stepId": "defense-contribution", "value": 3.3333333333333333333333333334 },
      { "stepId": "level-square", "value": 4 },
      { "stepId": "level-contribution", "value": 0.1333333333333333333333333333 },
      { "stepId": "raw-sd", "value": 103.06666666666666666666666666 },
      { "stepId": "visible-sd", "value": 103 }
    ],
    "rounding": { "mode": "TRUNCATE", "stage": "visible-sd", "decimalPlaces": 0 },
    "rawOutput": 103.06666666666666666666666666,
    "visibleOutput": 103,
    "evidenceRefs": ["evd-0021", "evd-0026", "evd-0034"],
    "conflictIds": []
  }
}
