{
  "schemaVersion": "1.0.0",
  "id": "ag-dark-knight-base",
  "rulesetId": "mu-s4-global-reference",
  "formulaRef": { "id": "formula-ag-dark-knight", "version": "1.0.0" },
  "context": {
    "characterClassId": "class-dark-knight",
    "evolutionId": "evolution-dark-knight"
  },
  "inputs": { "energy": 10, "vitality": 25, "agility": 20, "strength": 28 },
  "expectedTrace": {
    "schemaVersion": "1.0.0",
    "id": "trace-ag-dark-knight-base",
    "rulesetId": "mu-s4-global-reference",
    "formulaRef": { "id": "formula-ag-dark-knight", "version": "1.0.0" },
    "context": {
      "characterClassId": "class-dark-knight",
      "evolutionId": "evolution-dark-knight"
    },
    "inputs": { "energy": 10, "vitality": 25, "agility": 20, "strength": 28 },
    "steps": [
      { "stepId": "vitality-contribution", "value": 7.5 },
      { "stepId": "agility-contribution", "value": 4.0 },
      { "stepId": "strength-contribution", "value": 4.20 },
      { "stepId": "raw-ag", "value": 25.70 },
      { "stepId": "visible-ag", "value": 25 }
    ],
    "rounding": { "mode": "TRUNCATE", "stage": "visible-ag", "decimalPlaces": 0 },
    "rawOutput": 25.70,
    "visibleOutput": 25,
    "evidenceRefs": ["evd-0021", "evd-0026"],
    "conflictIds": []
  }
}
