{
  "schemaVersion": "1.0.0",
  "id": "speed-fairy-elf-integer-step",
  "rulesetId": "mu-s4-global-reference",
  "formulaRef": {
    "id": "formula-speed-fairy-elf",
    "version": "1.0.0"
  },
  "context": {
    "characterClassId": "class-fairy-elf",
    "evolutionId": "evolution-fairy-elf"
  },
  "inputs": {
    "agility": 50
  },
  "expectedTrace": {
    "schemaVersion": "1.0.0",
    "id": "trace-speed-fairy-elf-integer-step",
    "rulesetId": "mu-s4-global-reference",
    "formulaRef": {
      "id": "formula-speed-fairy-elf",
      "version": "1.0.0"
    },
    "context": {
      "characterClassId": "class-fairy-elf",
      "evolutionId": "evolution-fairy-elf"
    },
    "inputs": {
      "agility": 50
    },
    "steps": [
      {
        "stepId": "raw-speed",
        "value": 1
      },
      {
        "stepId": "visible-speed",
        "value": 1
      }
    ],
    "rounding": {
      "mode": "TRUNCATE",
      "stage": "visible-speed",
      "decimalPlaces": 0
    },
    "rawOutput": 1,
    "visibleOutput": 1,
    "evidenceRefs": [
      "evd-0021",
      "evd-0026"
    ],
    "conflictIds": []
  }
}