{
  "schemaVersion": "1.0.0",
  "id": "sd-summoner-base",
  "rulesetId": "mu-s4-global-reference",
  "formulaRef": { "id": "formula-sd-summoner", "version": "1.0.0" },
  "context": { "characterClassId": "class-summoner", "evolutionId": "evolution-summoner" },
  "inputs": { "character-level": 1, "strength": 21, "agility": 21, "vitality": 18, "energy": 23, "defense": 7 },
  "expectedTrace": {
    "schemaVersion": "1.0.0",
    "id": "trace-sd-summoner-base",
    "rulesetId": "mu-s4-global-reference",
    "formulaRef": { "id": "formula-sd-summoner", "version": "1.0.0" },
    "context": { "characterClassId": "class-summoner", "evolutionId": "evolution-summoner" },
    "inputs": { "character-level": 1, "strength": 21, "agility": 21, "vitality": 18, "energy": 23, "defense": 7 },
    "steps": [
      { "stepId": "stat-sum", "value": 83 },
      { "stepId": "stat-product", "value": 99.6 },
      { "stepId": "stat-term", "value": 99 },
      { "stepId": "defense-product", "value": 3.5 },
      { "stepId": "defense-term", "value": 3 },
      { "stepId": "level-square", "value": 1 },
      { "stepId": "level-product", "value": 0.0333333333333333333333333333 },
      { "stepId": "level-term", "value": 0 },
      { "stepId": "raw-sd", "value": 102 },
      { "stepId": "visible-sd", "value": 102 }
    ],
    "rounding": { "mode": "TRUNCATE", "stage": "visible-sd", "decimalPlaces": 0 },
    "rawOutput": 102,
    "visibleOutput": 102,
    "evidenceRefs": ["evd-0021", "evd-0026", "evd-0032", "evd-0034"],
    "conflictIds": ["dsp-0004"]
  }
}
