{
  "schemaVersion": "1.0.0",
  "id": "defense-dark-knight-fraction-step",
  "rulesetId": "mu-s4-global-reference",
  "formulaRef": { "id": "formula-defense-dark-knight", "version": "1.0.0" },
  "context": { "characterClassId": "class-dark-knight", "evolutionId": "evolution-blade-knight" },
  "inputs": { "agility": 22 },
  "expectedTrace": {
    "schemaVersion": "1.0.0",
    "id": "trace-defense-dark-knight-fraction-step",
    "rulesetId": "mu-s4-global-reference",
    "formulaRef": { "id": "formula-defense-dark-knight", "version": "1.0.0" },
    "context": { "characterClassId": "class-dark-knight", "evolutionId": "evolution-blade-knight" },
    "inputs": { "agility": 22 },
    "steps": [
      { "stepId": "raw-defense", "value": 7.3333333333333333333333333333 },
      { "stepId": "visible-defense", "value": 7 }
    ],
    "rounding": { "mode": "TRUNCATE", "stage": "visible-defense", "decimalPlaces": 0 },
    "rawOutput": 7.3333333333333333333333333333,
    "visibleOutput": 7,
    "evidenceRefs": ["evd-0021", "evd-0026"],
    "conflictIds": []
  }
}
