{
  "schemaVersion": "1.0.0",
  "id": "min-damage-dark-knight-fraction-step",
  "rulesetId": "mu-s4-global-reference",
  "formulaRef": { "id": "formula-min-damage-dark-knight", "version": "1.0.0" },
  "context": { "characterClassId": "class-dark-knight", "evolutionId": "evolution-dark-knight" },
  "inputs": { "strength": 29 },
  "expectedTrace": {
    "schemaVersion": "1.0.0",
    "id": "trace-min-damage-dark-knight-fraction-step",
    "rulesetId": "mu-s4-global-reference",
    "formulaRef": { "id": "formula-min-damage-dark-knight", "version": "1.0.0" },
    "context": { "characterClassId": "class-dark-knight", "evolutionId": "evolution-dark-knight" },
    "inputs": { "strength": 29 },
    "steps": [
      { "stepId": "raw-min-damage", "value": 4.8333333333333333333333333333 },
      { "stepId": "visible-min-damage", "value": 4 }
    ],
    "rounding": { "mode": "TRUNCATE", "stage": "visible-min-damage", "decimalPlaces": 0 },
    "rawOutput": 4.8333333333333333333333333333,
    "visibleOutput": 4,
    "evidenceRefs": ["evd-0021", "evd-0026"],
    "conflictIds": []
  }
}
