{
  "schemaVersion": "1.0.0",
  "id": "damage-buff-fairy-elf-base",
  "rulesetId": "mu-s4-global-reference",
  "formulaRef": {
    "id": "formula-damage-buff-fairy-elf",
    "version": "1.0.0"
  },
  "context": {
    "characterClassId": "class-fairy-elf",
    "evolutionId": "evolution-fairy-elf"
  },
  "inputs": {
    "energy": 15
  },
  "expectedTrace": {
    "schemaVersion": "1.0.0",
    "id": "trace-damage-buff-fairy-elf-base",
    "rulesetId": "mu-s4-global-reference",
    "formulaRef": {
      "id": "formula-damage-buff-fairy-elf",
      "version": "1.0.0"
    },
    "context": {
      "characterClassId": "class-fairy-elf",
      "evolutionId": "evolution-fairy-elf"
    },
    "inputs": {
      "energy": 15
    },
    "steps": [
      {
        "stepId": "energy-term",
        "value": 2.1428571428571428571428571429
      },
      {
        "stepId": "raw-damage-buff",
        "value": 5.1428571428571428571428571429
      },
      {
        "stepId": "visible-damage-buff",
        "value": 5
      }
    ],
    "rounding": {
      "mode": "TRUNCATE",
      "stage": "visible-damage-buff",
      "decimalPlaces": 0
    },
    "rawOutput": 5.1428571428571428571428571429,
    "visibleOutput": 5,
    "evidenceRefs": [
      "evd-0021",
      "evd-0026"
    ],
    "conflictIds": []
  }
}