{
  "schemaVersion": "1.0.0",
  "id": "speed-dark-wizard-fraction-step",
  "rulesetId": "mu-s4-global-reference",
  "formulaRef": {
    "id": "formula-speed-dark-wizard",
    "version": "1.0.0"
  },
  "context": {
    "characterClassId": "class-dark-wizard",
    "evolutionId": "evolution-dark-wizard"
  },
  "inputs": {
    "agility": 19
  },
  "expectedTrace": {
    "schemaVersion": "1.0.0",
    "id": "trace-speed-dark-wizard-fraction-step",
    "rulesetId": "mu-s4-global-reference",
    "formulaRef": {
      "id": "formula-speed-dark-wizard",
      "version": "1.0.0"
    },
    "context": {
      "characterClassId": "class-dark-wizard",
      "evolutionId": "evolution-dark-wizard"
    },
    "inputs": {
      "agility": 19
    },
    "steps": [
      {
        "stepId": "raw-speed",
        "value": 1.9
      },
      {
        "stepId": "visible-speed",
        "value": 1
      }
    ],
    "rounding": {
      "mode": "TRUNCATE",
      "stage": "visible-speed",
      "decimalPlaces": 0
    },
    "rawOutput": 1.9,
    "visibleOutput": 1,
    "evidenceRefs": [
      "evd-0021",
      "evd-0026"
    ],
    "conflictIds": []
  }
}