{
  "schemaVersion": "1.0.0",
  "id": "pvm-defense-rate-fairy-elf-high-elf-step",
  "rulesetId": "mu-s4-global-reference",
  "formulaRef": { "id": "formula-pvm-defense-rate-fairy-elf", "version": "1.0.0" },
  "context": { "characterClassId": "class-fairy-elf", "evolutionId": "evolution-high-elf" },
  "inputs": { "agility": 400 },
  "expectedTrace": {
    "schemaVersion": "1.0.0",
    "id": "trace-pvm-defense-rate-fairy-elf-high-elf-step",
    "rulesetId": "mu-s4-global-reference",
    "formulaRef": { "id": "formula-pvm-defense-rate-fairy-elf", "version": "1.0.0" },
    "context": { "characterClassId": "class-fairy-elf", "evolutionId": "evolution-high-elf" },
    "inputs": { "agility": 400 },
    "steps": [
      { "stepId": "raw-pvm-defense-rate", "value": 100 },
      { "stepId": "visible-pvm-defense-rate", "value": 100 }
    ],
    "rounding": { "mode": "TRUNCATE", "stage": "visible-pvm-defense-rate", "decimalPlaces": 0 },
    "rawOutput": 100,
    "visibleOutput": 100,
    "evidenceRefs": ["evd-0021", "evd-0026"],
    "conflictIds": []
  }
}
