{
  "schemaVersion": "1.0.0",
  "id": "pvp-defense-rate-magic-gladiator-duel-master-step",
  "rulesetId": "mu-s4-global-reference",
  "formulaRef": { "id": "formula-pvp-defense-rate-magic-gladiator", "version": "1.0.0" },
  "context": { "characterClassId": "class-magic-gladiator", "evolutionId": "evolution-duel-master" },
  "inputs": { "agility": 500, "character-level": 220 },
  "expectedTrace": {
    "schemaVersion": "1.0.0",
    "id": "trace-pvp-defense-rate-magic-gladiator-duel-master-step",
    "rulesetId": "mu-s4-global-reference",
    "formulaRef": { "id": "formula-pvp-defense-rate-magic-gladiator", "version": "1.0.0" },
    "context": { "characterClassId": "class-magic-gladiator", "evolutionId": "evolution-duel-master" },
    "inputs": { "agility": 500, "character-level": 220 },
    "steps": [
      { "stepId": "level-contribution", "value": 440 },
      { "stepId": "agility-contribution", "value": 125.00 },
      { "stepId": "raw-pvp-defense-rate", "value": 565.00 },
      { "stepId": "visible-pvp-defense-rate", "value": 565 }
    ],
    "rounding": { "mode": "TRUNCATE", "stage": "visible-pvp-defense-rate", "decimalPlaces": 0 },
    "rawOutput": 565.00,
    "visibleOutput": 565,
    "evidenceRefs": ["evd-0021", "evd-0026"],
    "conflictIds": []
  }
}
